<?xml version="1.0" encoding="UTF-8"?>

<db xmlns="http://hongs-core"
xmlns:xsi="http://www.w3.org/2001/XMLSchema-instance"
xsi:schemaLocation="http://hongs-core db.xsd">
    <config link="default"/>
    <driver link="default"/>
    <source link="default"/>
    <tables>
        <table name="ar_datasrc_base_info"
               primaryKey="id">
            <assoc type="HAS_MANY"
                   name="ar_datasrc_conf_info"
                   foreignKey="datasrc_id"/>
        </table>
        <table name="ar_dataset_base_info"
               primaryKey="id">
            <assoc type="BLS_TO"
                   name="ar_datasrc_base_info"
                   foreignKey="datasrc_id"/>
            <assoc type="HAS_MANY"
                   name="ar_dataset_conf_info"
                   foreignKey="dataset_id"/>
            <assoc type="HAS_MANY"
                   name="ar_dataset_cols_info"
                   foreignKey="dataset_id"/>
            <assoc type="HAS_MANY"
                   name="ar_dataset_load_log"
                   foreignKey="dataset_id"/>
        </table>
        <table name="ar_datasrc_conf_info"
               primaryKey="id"/>
        <table name="ar_dataset_conf_info"
               primaryKey="id"/>
        <table name="ar_dataset_cols_info"
               primaryKey="id"/>
        <table name="ar_dataset_load_log"
               primaryKey="id"/>
    </tables>
</db>