<?xml version="1.0" encoding="utf-8" standalone="no"?>
<db xmlns="http://hongs-core"
xmlns:xsi="http://www.w3.org/2001/XMLSchema-instance"
xsi:schemaLocation="http://hongs-core db.xsd">
    <source link="default"/>
    <origin link="default"/>
    <tables>
        <table name="demo1"
               tableName="a_demo_1"
               primaryKey="id">
            <assoc type="HAS_MANY"
                   name="demo2s"
                   tableName="demo2"
                   foreignKey="demo1_id"/>
            <assoc type="HAS_ONE"
                   name="demo5"
                   tableName="demo5"
                   foreignKey="demo1_id"/>
        </table>
        <!-- 多对一 -->
        <table name="demo2"
               tableName="a_demo_2"
               primaryKey="id">
            <assoc type="BLS_TO"
                   name="demo1"
                   tableName="demo1"
                   foreignKey="demo1_id"/>
        </table>
        <!-- 多对多 -->
        <table name="demo4"
               tableName="a_demo_4"
               primaryKey="id">
            <assoc type="HAS_MANY"
                   name="demo2s"
                   tableName="demo3"
                   foreignKey="demo4_id"/>
                <assoc type="BLS_TO"
                       name="demo2"
                       tableName="demo2"
                       foreignKey="demo2_id"/>
        </table>
        <table name="demo5"
               tableName="a_demo_5"
               primaryKey="id">
            <assoc type="BLS_TO"
                   name="demo1"
                   tableName="demo1"
                   foreignKey="demo1_id"/>
        </table>
        <table name="a_demo_3"/>
    </tables>
</db>
